HistoryID,CustomerID,BookingID,PaymentID,Action,ActionDate
1,57,51,5,Meeting meeting idea nice represent newspaper.,2023-06-15
2,13,15,183,Relate sell market someone leg drug.,2023-07-12
3,33,173,32,Foot stock high produce doctor beautiful.,2023-10-01
4,26,187,55,Low indeed eat force man early.,2023-11-13
5,71,185,181,Particularly level scene really.,2023-09-01
6,69,66,26,Middle early Democrat name.,2023-12-24
7,89,116,9,Some we Democrat project of turn thus.,2023-09-01
8,7,32,39,Young word cut.,2023-06-19
9,37,64,171,Teacher other television member consumer career throughout yeah.,2023-07-17
10,16,130,125,Seem grow reflect glass close media little not.,2023-12-22
11,98,173,105,Including result service arm high.,2023-08-12
12,27,31,126,Commercial accept walk everybody financial sometimes three.,2023-09-21
13,78,180,132,Cover half old write fine scene.,2023-12-25
14,78,166,98,Maintain bring camera final make from staff.,2023-06-06
15,44,69,105,Specific build collection.,2023-06-12
16,66,125,101,Any account Democrat treat.,2023-10-08
17,37,72,156,Control market all leave.,2023-12-26
18,8,153,121,Figure economy some maybe.,2023-11-30
19,13,133,172,Purpose outside source fire other study.,2023-06-17
20,16,53,27,Two back project cultural listen deep development.,2023-10-22
21,81,81,141,Sing figure seven effect over where expect.,2023-11-01
22,63,89,13,Size price range cost parent major.,2023-08-03
23,2,154,16,Pattern media seat hold many war same bank.,2023-11-14
24,78,140,62,Future shoulder change store strategy there.,2023-07-17
25,99,149,116,Student production sure.,2023-06-17
26,71,179,2,Simple language east then pressure oil present myself.,2023-11-01
27,93,96,17,House only wind natural position age quite major.,2023-11-23
28,67,192,103,Than option structure sound front nor push nearly.,2023-08-14
29,86,56,187,Skill get minute each.,2023-07-15
30,3,152,75,Bank green receive key.,2023-07-10
31,98,153,15,Rise defense recognize.,2023-12-02
32,37,135,171,Human lot will course.,2023-07-13
33,84,81,171,Enough father ball why believe open relate per.,2023-09-22
34,52,185,119,Language effect role middle ever operation training.,2023-09-02
35,31,128,198,Speech never decision win world.,2023-12-26
36,53,69,136,Gas tough that return.,2023-11-04
37,80,54,43,Bill tonight under small a.,2023-06-18
38,96,170,172,Coach beat now imagine appear plan.,2023-07-29
39,63,102,14,Wrong attack house other.,2023-06-04
40,70,172,21,Thousand scientist at trade he.,2023-09-04
41,87,145,50,Interesting pattern while anyone wear pass.,2023-10-30
42,3,190,128,Force choice remain fund security challenge majority.,2023-07-31
43,44,141,121,Test store Congress example wonder store offer.,2023-06-08
44,96,41,198,Young peace store my party.,2023-08-11
45,22,176,55,Begin parent cultural data around.,2023-10-03
46,52,131,118,Market foreign be debate a drug.,2023-08-20
47,68,43,86,Sign business bill few surface south case.,2023-11-14
48,23,63,92,Collection others usually list.,2023-07-27
49,10,53,42,National force suggest sure.,2023-07-18
50,30,159,11,Mother under ever eight itself home eight everything.,2023-09-05
51,6,135,140,Black know expect ground develop something.,2023-08-19
52,58,73,102,Here claim job he whether.,2023-10-25
53,66,112,23,Leave process upon performance professor break.,2023-12-19
54,100,173,178,Man direction education good increase end improve.,2023-06-07
55,21,35,158,Offer right discuss leave arm issue face.,2023-10-14
56,85,170,187,Perform water final economy staff always.,2023-12-01
57,95,127,62,Radio consumer cell itself effect hand response.,2023-12-27
58,21,152,68,Likely effect face later idea.,2023-09-07
59,23,1,80,Last can daughter.,2023-08-14
60,27,12,169,Mr fill gun.,2023-09-02
61,80,47,121,Back art apply else young begin.,2023-12-16
62,27,35,196,Every whatever put build nearly special.,2023-08-31
63,73,116,195,Reality else simple different already write.,2023-09-10
64,61,159,47,Design myself some western above.,2023-06-18
65,62,164,152,Call southern interview degree artist.,2023-10-31
66,14,171,90,Main increase form spend join mission.,2023-07-26
67,10,154,122,Use consumer really reason experience despite cause.,2023-11-20
68,82,125,79,Future our oil middle since behind.,2023-12-16
69,79,187,57,Almost close difficult note class measure.,2023-08-30
70,17,15,90,Produce image expect than and television.,2023-07-07
71,22,145,34,Who scene sense suggest.,2023-08-16
72,9,118,34,Foreign word its late win capital.,2023-12-19
73,51,135,153,Also whatever state still plant.,2023-07-26
74,44,21,74,Support single staff two score.,2023-09-27
75,52,165,52,Use draw chance front husband trade.,2023-09-13
76,89,9,42,With alone degree.,2023-06-27
77,31,58,80,Enough skin vote hold.,2023-09-06
78,49,94,118,Wall free trouble research front mouth.,2023-07-05
79,48,38,122,Education pull husband forget quite consumer seek.,2023-06-19
80,75,178,35,Later mission answer laugh new have.,2023-06-25
81,54,8,25,Consumer end free stay fire you everything.,2023-07-13
82,66,33,109,Past professor four executive.,2023-12-11
83,86,153,40,Young fund about finally business trouble.,2023-10-07
84,86,174,92,Necessary large marriage third.,2023-10-21
85,16,150,38,Down industry responsibility budget.,2023-06-09
86,86,35,102,Skill that build seem what policy me possible.,2023-08-09
87,98,135,179,Least figure campaign determine everybody.,2023-12-13
88,56,192,174,Call project treat explain.,2023-11-23
89,67,148,178,Newspaper behind audience moment security institution.,2023-10-12
90,89,49,156,Film doctor that make newspaper seek job.,2023-07-19
91,24,166,122,Keep chance walk.,2023-11-01
92,88,180,111,Or page speak time such.,2023-07-04
93,20,92,15,Least day reality deal because area.,2023-11-02
94,73,118,116,Us trial product edge stay write.,2023-11-10
95,53,14,22,Citizen camera everyone hundred majority blue.,2023-08-17
96,21,52,1,Sign voice special three answer dog.,2023-10-17
97,97,88,122,Cup class understand whose accept.,2023-07-15
98,32,24,21,Sea draw national send foot.,2023-06-04
99,86,75,138,Until program second claim cut mention half.,2023-06-18
100,14,49,69,Guess color him space join garden left.,2023-08-24
101,18,109,90,None region word improve skill.,2023-12-26
102,67,98,144,Rise wait dog.,2023-11-07
103,51,112,49,Sport ask even.,2023-09-11
104,6,148,85,Data serve offer support these.,2023-09-30
105,52,58,67,Treatment table hard along discussion partner year a.,2023-11-09
106,67,71,25,Financial into during outside full.,2023-12-29
107,84,41,61,Inside hair change cut.,2023-08-23
108,13,92,108,Point space play state.,2023-07-20
109,56,169,24,Before example current watch put lay.,2023-08-01
110,26,99,180,Speech fish author hospital.,2023-08-10
111,99,25,75,Goal statement room art.,2023-11-26
112,15,80,119,Plan sense method word.,2023-11-20
113,30,163,185,Feel teach own place run bank.,2023-07-24
114,12,101,155,Again outside across purpose grow first.,2023-06-04
115,89,90,124,Someone on current find.,2023-10-02
116,3,109,187,Company become no cover although politics minute.,2023-09-18
117,83,1,69,International second year just.,2023-10-13
118,29,46,77,Ground star democratic kid education whether difficult.,2023-08-13
119,94,111,13,Resource picture them figure.,2023-12-23
120,15,38,47,Forget throw opportunity interesting if this.,2023-12-09
121,34,33,14,It go tree serve five ball big.,2023-08-26
122,66,68,47,However night medical somebody.,2023-08-31
123,27,195,163,Friend race population its question.,2023-12-15
124,86,100,58,How lawyer five page analysis rule.,2023-08-23
125,45,79,84,Candidate factor cell.,2023-09-08
126,6,159,24,Nothing many adult increase general source.,2023-08-03
127,68,150,10,Address though go late hospital.,2023-12-26
128,68,55,144,Stock ability value bed level professor huge.,2023-10-16
129,87,18,131,Rule may international behind purpose.,2023-09-28
130,54,183,159,Where bed nature.,2023-10-08
131,67,58,42,Item speak fill.,2023-09-27
132,39,124,26,Really enough imagine conference travel vote according.,2023-11-11
133,74,170,171,Far campaign produce and ok few.,2023-11-02
134,99,172,90,Letter treatment see rate work.,2023-08-27
135,90,61,16,Bring they fill among site your.,2023-10-04
136,74,55,165,Reach information central hundred inside ground.,2023-10-08
137,93,107,31,Whose wish environment character character organization.,2023-11-16
138,39,127,38,Wrong politics must state sense tough protect.,2023-06-17
139,72,176,164,Live community national since.,2023-07-19
140,57,93,119,Safe authority modern scene.,2023-07-16
141,3,44,119,Source they card.,2023-09-18
142,92,172,112,Of easy home bag music ball.,2023-11-15
143,24,154,153,Imagine common detail enter Congress.,2023-11-08
144,97,66,122,Traditional bag camera face build.,2023-09-13
145,88,37,58,Since nothing soon skill.,2023-06-02
146,63,12,15,Movie page political thus official involve.,2023-08-18
147,20,152,7,Hundred management particular mention week.,2023-10-03
148,19,194,153,Minute one walk guy.,2023-09-30
149,78,153,93,Age coach stuff plan whether partner.,2023-08-15
150,14,160,50,Summer purpose seven wait would community threat according.,2023-12-10
151,99,104,28,Should skill stand yourself section claim.,2023-06-22
152,47,163,195,Sure sport arrive health.,2023-07-11
153,91,74,170,Letter system short whom tough candidate nice.,2023-10-24
154,9,197,110,Congress behavior yes ok author various agreement item.,2023-08-09
155,67,110,34,Page drug hot lose television list relationship.,2023-11-27
156,82,30,75,Late represent local husband full.,2023-09-16
157,28,129,68,View serve value quality.,2023-09-17
158,76,171,104,Each need phone modern store little.,2023-12-01
159,70,41,149,Far kind generation key with bank police.,2023-07-27
160,31,113,57,Yes prepare involve student.,2023-09-22
161,58,115,110,Indicate voice realize support range whose win.,2023-10-20
162,45,110,29,Dog loss skill never beyond among have.,2023-12-17
163,84,1,170,Office management possible group thing a.,2023-08-10
164,52,195,14,Within commercial contain five security raise.,2023-10-24
165,52,59,30,Often discussion effect.,2023-07-26
166,41,21,171,Election call apply happen.,2023-09-26
167,56,63,146,Finish modern feeling human single.,2023-10-16
168,4,155,51,Lose sign western end view almost.,2023-12-23
169,50,62,162,Learn community industry.,2023-11-09
170,11,170,103,Firm town identify drop morning language true.,2023-11-26
171,19,64,79,Thus perform possible in.,2023-11-29
172,30,195,165,Question song force prepare nor into gun.,2023-09-09
173,53,53,177,Rich Republican expert present perform require interesting nearly.,2023-06-27
174,74,26,144,Present close quickly teacher live Mrs.,2023-10-06
175,63,168,165,Positive term age season also shake Mr.,2023-09-11
176,53,92,162,May need option smile herself save.,2023-07-30
177,74,93,47,Site group join small.,2023-06-27
178,53,71,79,Never market shake too commercial either occur state.,2023-09-16
179,81,32,159,Budget apply what reflect attorney.,2023-08-02
180,82,151,83,Mr response clear learn compare.,2023-11-16
181,64,120,121,Already personal north might season.,2023-07-05
182,81,62,125,Soon and carry little ten.,2023-07-24
183,41,53,158,Doctor debate like level gas nation.,2023-12-14
184,11,165,109,More forward woman.,2023-09-29
185,99,197,141,Plan address soon listen.,2023-11-26
186,100,90,176,Middle financial front according continue effort.,2023-07-17
187,2,55,10,Bed want gun investment color.,2023-11-13
188,37,16,80,Surface this someone game southern pass culture.,2023-09-11
189,22,116,19,Record more happy nice view attack fear.,2023-08-19
190,3,20,128,Will ahead sister among tell indicate physical.,2023-11-22
191,15,11,184,Guess together relationship tree.,2023-06-14
192,9,38,62,Price entire only another whose.,2023-11-27
193,86,78,135,Phone best office picture.,2023-07-11
194,15,145,178,Market she kitchen into almost white be.,2023-07-03
195,5,115,64,Door act coach southern include.,2023-11-10
196,24,102,157,Marriage tough answer remain.,2023-10-30
197,77,68,181,Crime nothing green present it home.,2023-07-29
198,50,150,121,Move bank successful pull last.,2023-10-05
199,36,26,11,Hot boy eye else medical network think.,2023-06-11
200,69,29,111,Order member heart cup feeling maintain particular.,2023-08-18
